{
  "$schema": "https://json-schema.org/draft/2020-12/schema",
  "title": "Projects (04-projects/projects.json)",
  "type": "array",
  "items": {
    "type": "object",
    "required": ["id", "internal_name", "summary", "evidence_ids", "role", "scope",
                 "start", "end", "rank", "rank_reasons", "metric_prompt"],
    "additionalProperties": false,
    "properties": {
      "id": {"type": "string", "pattern": "^pj_[0-9a-f]{8}$"},
      "internal_name": {"type": "string", "minLength": 1},
      "summary": {"type": "string"},
      "evidence_ids": {
        "type": "array", "minItems": 1,
        "items": {"type": "string", "pattern": "^ev_[0-9a-f]{8}([0-9a-f]{4})?$"}
      },
      "role": {"enum": ["lead", "core", "supporting"]},
      "scope": {"enum": ["team", "cross-team", "org", "company"]},
      "start": {"type": "string", "pattern": "^\\d{4}-\\d{2}$"},
      "end": {"type": ["string", "null"], "pattern": "^\\d{4}-\\d{2}$"},
      "rank": {"type": "integer", "minimum": 1},
      "rank_reasons": {"type": "array", "items": {"type": "string"}},
      "metric_prompt": {"type": "boolean"}
    }
  }
}
